"nomeempreendedor","total_barragens"
"MINERACAO POSITIVA LTDA EM","2"
"MINERACAO SERRAS DO OESTE LIMITADA","3"
"SANTA FELICIDADE MINERACAO SPE LTDA","5"
"SAINT-GOBAIN DO BRASIL PRODUTOS INDUSTRIAIS E PARA CONSTRUCAO LTDA","2"
"MAGNESITA MINERACAO S.A.","14"
"UILSON ROMANHA & CIA LTDA","5"
"ANGLO AMERICAN MINERIO DE FERRO BRASIL S/A","7"
"SALINAS GOLD MINERACAO LTDA","5"
"Bento Soares de Brito","1"
"GABRIELLA MINERACAO LTDA","1"
"MINERACAO MATHEUS LEME LTDA","3"
"Marcio Nascimento","1"
"Euler Oliveira Coelho","1"
"Sandro de França","1"
"SANTA LUZ DESENVOLVIMENTO MINERAL LTDA","2"
"CIA DE FERRO LIGAS DA BAHIA FERBASA","5"
"EMPRESA DE MINERACAO ESPERANCA S A","3"
"CELESTA MINERACAO S.A","2"
"CSN CIMENTOS BRASIL S.A. Filial: CSN CIMENTOS BRASIL S.A.","1"
"AURA ALMAS MINERACAO S/A","1"
"FRANCISCO XAVIER DA SILVA","2"
"UNAMGEN MINERACAO E METALURGIA SA","1"
"EXTRACAO DE MINERIO BEARIZ LTDA","2"
"EMICON MINERACAO E TERRAPLENAGEM LIMITADA","4"
"J F Rost Martins","1"
"MINERADORA PONTE ALTA LTDA","3"
"Alcoa World Alumina Brasil Ltda.","9"
"Joaquim Aderaldo de Souza Neto","2"
"ITAMINAS COMERCIO DE MINERIOS SA","3"
"ANTONIO CAROLINO DE SOUZA","1"
"MINERACAO SAO FRANCISCO DE ASSIS LTDA","1"
"YARA BRASIL FERTILIZANTES S/A Filial: YARA BRASIL FERTILIZANTES S/A","1"
"MAX JOEL RUSSI","2"
"MINERACAO DO VALE LTDA","1"
"ESTANHO DE RONDONIA S/A","4"
"Pedreira Engebrita Ltda","1"
"Cooperativa de Extração de Carvão Mineral dos Trabalhadores de Criciúma","1"
"FREDERICO AUGUSTO DE ARRUDA GIMENEZ MINERACAO","1"
"Mineração Nova Petrópolis Ltda.","1"
"YAN BITTENCOURT NASCIMENTO","1"
"ROZEN MINERADORA, CONSULTORIA E ASSESSORIA EM GESTAO EMPRESARIAL LTDA","1"
"GRANHA LIGAS LTDA","1"
"VM MINERACAO LTDA","2"
"ALEX HENRIQUE CRUZ","1"
"MONTE SINAI MINERACAO LTDA","1"
"MINERACAO SANTA CRUZ LTDA","1"
"JONAS GIMENEZ RODRIGUES","1"
"A R WEBER","1"
"Marcir Norberto Weber","1"
"T. N. MINERACOES LTDA","1"
"MINERACAO VALE VERDE DO BRASIL LTDA.","1"
"M B L MATERIAIS BASICOS LTDA","2"
"BAUMINAS MINERACAO LTDA","2"
"CASA DE PEDRA LTDA","1"
"Roberto Nunes Rondon","1"
"COOPERMETAL - COOPERATIVA METALURGICA DE RONDONIA","2"
"YURI MACEDO OLIVEIRA","1"
"Diego Sérgio de oliveira Almeida","1"
"MINERACAO SANTA LUZIA LIMITADA","1"
"ATLANTIC NICKEL MINERACAO LTDA","2"
"Cooperativa de Mineração dos Garimpeiros do Lourenço Ltda","1"
"EMBU S A ENGENHARIA E COMERCIO","3"
"MSM Mineração Serra da Moeda Ltda.","10"
"JEFFERSON LUIZ DE ARRUDA E SILVA","1"
"AGIS MINERACAO LTDA.","1"
"COMPANHIA MINERADORA DO PIROCLORO DE ARAXA","2"
"FILADELFO DOS REIS DIAS","3"
"MINERACAO SERRA GRANDE S A","1"
"Indústria Carbonífera Rio Deserto Ltda","1"
"Carbonífera Belluno Ltda.","3"
"CLAUDIO HENRIQUE TEODORO DE ALMEIDA","2"
"TORIO BRASIL MINERACAO LTDA","1"
"GONCALO PEDROSO DE BARROS","1"
"EUROMAQUINAS MINERACAO LTDA","2"
"VERMELHAO MINERACAO INDUSTRIA E COMERCIO LTDA","1"
"CARBONIFERA METROPOLITANA S/A","4"
"CMOC BRASIL MINERACAO, INDUSTRIA E PARTICIPACOES LTDA.","5"
"COMPANHIA BRASILEIRA DE BENTONITA LTDA","1"
"Mib Mineração Ibirité Ltda","2"
"PEDREIRA UM VALEMIX LTDA","1"
"EXTRATIVA MINERAL S/A","2"
"MINERACAO TABOCA S A","15"
"ORO AMAPA MINERACAO","1"
"MINERACAO MARACA INDUSTRIA E COMERCIO S/A","1"
"MINERACAO PARAGOMINAS S.A.","1"
"PARA ALTA FLORESTA GOLD MINERACAO LTDA","1"
"VALE S.A.","108"
"MINERAÇÃO OURO BRANCO SALTO DE PIRAPORA LTDA ME","1"
"MINERACAO DARCY R.O. E SILVA LTDA","2"
"ALTA FLORESTA GOLD MINERACAO LTDA","3"
"Copelmi Mineração Ltda","2"
"EVALDO TESCHIMA LEITE","1"
"PEDRO CERQUEIRA CALDAS","1"
"Zamapá Mineração S.a.","1"
"NAGELLA CHRISSIE BRAVO SERRA","1"
"WHITE SOLDER METALURGIA E MINERACAO LTDA Filial: WHITE SOLDER METALURGIA E MINERACAO LTDA","1"
"Conterpa, Conservação e Terraplagem e Pavimentação Ltda","1"
"NORAIR NELSON DE SOUZA","2"
"PATOS DE MINAS FOSFATADOS LTDA","3"
"Mineração Vila Nova Ltda","2"
"Vantage Brasil Mineração Ltda.","1"
"PM1 MINERACAO LTDA","1"
"CSN MINERACAO S.A.","6"
"SAMARCO MINERACAO S.A. EM RECUPERACAO JUDICIAL","11"
"MINERAIS & METAIS COMERCIO E INDUSTRIA LTDA Filial: MINERAIS & METAIS COMERCIO E INDUSTRIA LTDA","1"
"MARCELO BOZETTI","2"
"SALITRE FERTILIZANTES LTDA.","1"
"MINERACAO TANQUE BELO LTDA","1"
"L V R COMERCIO E EXTRACAO MINERAL LTDA","1"
"PEDREIRAS BAHIA LTDA","1"
"FREDERICO AUGUSTO ROSA DO CARMO","1"
"MARCOS JOSE MARTINS FERNANDES","1"
"COOPERATIVA DE EXTRACAO MINERAL DE MATO GROSSO","3"
"CADAM S.A.","6"
"COOPERATIVA DE PRODUTORES DE ESTANHO DO BRASIL COOPERTIN","2"
"COMPANHIA BRASILEIRA DO COBRE","1"
"MINERACAO APOENA S.A.","4"
"Marcelo Busnardo EPP","1"
"MINERACAO MORRO DO IPE S.A.","4"
"GDMBRASIL - GEOLOGIA E DESENVOLVIMENTO MINERAL LTDA","2"
"MINERACAO AURIZONA S/A","2"
"NEXA RECURSOS MINERAIS S.A.","3"
"VALGNO DE MATOS TINOCO","1"
"M & J MINERACAO, PISCICULTURA E REFLORESTAMENTO - EIRELI","1"
"NORTE SUL TERRAPLENAGEM E COMERCIO LTDA","1"
"COOPROBAND - COOPERATIVA DE PRODUTORES MINERAIS DE NOVA BANDEIRANTES","2"
"METALMIG MINERACAO INDUSTRIA E COMERCIO S/A","8"
"BRASIL MINERIOS S/A","2"
"COMPANHIA BAIANA DE PESQUISA MINERAL CBPM","1"
"CAIO CESAR GIMENES RODRIGUES SILVA","1"
"FAZENDA BRASILEIRO DESENVOLVIMENTO MINERAL LTDA","3"
"ANGLOGOLD ASHANTI CORREGO DO SITIO MINERACAO S.A.","8"
"Humberto Covezzi","1"
"PROMETALICA MINERACAO LTDA","1"
"COMPANHIA BRASILEIRA DE ALUMINIO","2"
"HEUREKA MINERACAO LTDA","3"
"ARTEMYN RIO CAPIM CAULIM LTDA.","10"
"Marcus Vítor Nunes Lindote","1"
"NIKI MINERACAO, COMERCIO E EXPORTACAO LTDA.","1"
"MINERACAO GERAL DO BRASIL S/A","3"
"CENTRO OESTE GOLD MINE S.A.","1"
"SIDNEI RAFAEL DE SOUZA","4"
"MINERACAO RIO DO NORTE SA","32"
"MINERACAO RIACHO DOS MACHADOS LTDA.","1"
"ALAIN STEPHANE RIVIERE MINERACAO","3"
"COOPERATIVA MISTA DOS GARIMPEIROS DE PEIXOTO DE AZEVEDO","1"
"AMAPA MINERALS LTDA","3"
"Empresa de Mineração e Artefatos de Cimento Jbs Ltda Epp","1"
"FERROMINAS - MINERAÇÃO LTDA","2"
"EXTRACAO DE AREIA TABOAO LTDA","2"
"MINERBRAS MINERACAO LTDA","2"
"NORMA ARGES OLIVA","2"
"EMPRESA MINERADORA BOA SORTE LTDA","1"
"DUTRA EXTRACAO DE AREIA LTDA","1"
"PILAR DE GOIAS DESENVOLVIMENTO MINERAL LTDA","1"
"ADAO AFONSO RODUI","1"
"Jeová Barbosa de Morais","2"
"João Gimenes Rodrigues","1"
"COMPANHIA RIOGRANDENSE DE MINERACAO CRM","1"
"Empresa de Mineração Fiori do Taboão Ltda.","1"
"ARCELORMITTAL BRASIL S.A.","10"
"CASCAR BRASIL MINERACAO LTDA","1"
"ELISA MACIEL SANTOS RIVA","1"
"BRAZAURO RECURSOS MINERAIS S.A.","3"
"DELIA GODOY RAZUK","1"
"COOPERATIVA MINERADORA DOS GARIMPEIROS DE ARIQUEMES - COOMIGA","9"
"MINERACAO PARAGOMINAS S.A. Filial: MINERACAO PARAGOMINAS S.A.","3"
"Maxcimiliano Mendes Nascimento","1"
"MINERACAO NOSSA SENHORA DO CARMO LTDA","2"
"ITAFOS ARRAIAS MINERACAO E FERTILIZANTES S.A.","1"
"MINERACAO FL JOTAS LTDA","2"
"EXTRAÇÃO E COMÉRCIO DE AREIA BOFETE LTDA","1"
"DIEGO MACEDO CARDOSO","1"
"AVB MINERACAO LTDA.","3"
"BRASE - BRASIL EXTRACAO, COMERCIO E INDUSTRIA DE ESTANHO EIRELI","1"
"CARBONIFERA SIDEROPOLIS LTDA","2"
"A. C. ZARANELLA LTDA","1"
"MINERIOS NACIONAL S.A.","3"
"GF GOLD MINERACAO EIRELI","2"
"PORTO DE AREIA BRANCA LTDA","1"
"GERDAU ACOMINAS S/A","6"
"LARGO VANADIO DE MARACAS S.A","4"
"JOAO ROBERTO CARDOSO","1"
"SICAL INDUSTRIAL LTDA.","1"
"RENALDO RUDI SCHORK","1"
"MINAR MINERACAO AREDES LTDA","1"
"PEDREIRA IBIUNA LTDA","2"
"COOPERATIVA DE EXTRACAO MINERAL DE NOSSA SENHORA DO LIVRAMENTO","6"
"Extrativa Metalurgia S A","1"
"Topazio Imperial Mineração Comercio e Industria Ltda","1"
"R G R FILHO MINERACAO","1"
"SAMACA FERROS LTDA","5"
"ROSEMEIRE BENEDETTI ALVES","2"
"FARIAS & RODRIGUES LTDA","1"
"LHG MINING CORUMBA S.A","3"
"VALLOUREC TUBOS DO BRASIL LTDA.","3"
"CATARINO PEDROSO DE BARROS","1"
"Davi Alves Bicalho","2"
"Fellipe Gabriel Firmino Bravo","1"
"DISK-BASE EXT.DE AREIA E COM.DE MAT.P/CONST.LTDA","3"
"HUMBERTO AFFONSO DEL NERY","1"
"Mineração Santa Luzia de Aguaí Ltda","2"
"MINERACAO BOM RETIRO LTDA","1"
"Valdinei Mauro de Souza","11"
"Mineração Sanguinete Ltda","1"
"COOPERATIVA DOS GARIMPEIROS DO VALE DO VILA NOVA","4"
"RIDALECIO DE SOUZA","1"
"M. M. GOLD MINERACAO LTDA","3"
"SERABI MINERACAO S.A.","3"
"Ricardo Padilla de Bordon Neves","1"
"Robinson da Silva Bravo","1"
"SERRINHA GOLDMINE LTDA","1"
"Geominas Minerações Ltda.","3"
"EMPRESA DE MINERACAO, EXPORTACAO E PESQUISA DO AMAPA LTDA","1"
"MOSAIC FERTILIZANTES P&K LTDA.","30"
"L PAVAN & CIA LTDA","2"
"SALOBO METAIS S/A","12"
"XILOLITE S/A","1"
"MINERACAO JUNDU LTDA","5"
"MINERADORA AREIA NOVA LTDA","3"
"JOSE MARIA OTAVIO MARTINS DUARTE","3"
"ADRIANO JOSE DE MOURA SOUSA","1"
"CONCRESAND MINERACAO E TRANSPORTE LTDA","1"
"CSN CIMENTOS S.A.","2"
"EXTRACAO E COMERCIO DE AREIA QUEVEDO & SILVA LTDA","2"
"INDUSTRIA E COMERCIO DE MINERIOS S/A - ICOMI","6"
"SANDER LIMA DE FRANCA","1"
"MINERADORA PEDRIX LTDA","1"
"Rodrigo Moraes Fiacadori","1"
"KINROSS BRASIL MINERACAO S/A","6"
"COOPERATIVA DE MINERACAO DOS GARIMPEIROS DE PONTES E LACERDA - COMPEL","7"
"Victor Augusto de Arruda Gimenez","1"
"AGROPECUARIA SERRAMAR LTDA","1"
"SERGIO DA SILVA","2"
"VETRIA MINERACAO S.A.","4"
"MINERACAO ONCA PUMA S.A.","9"
"RIVER GOLD MINERACAO LTDA","1"
"Pollyana Moreira Dias","1"
"HELLEN ELIZABETH CORREA MARTINS","2"
"CBE COMPANHIA BRASILEIRA DE EQUIPAMENTO Filial: CBE COMPANHIA BRASILEIRA DE EQUIPAMENTO - EM RECUPERACAO JUDICIAL","1"
"INDUSTRIAS NUCLEARES DO BRASIL S.A - INB","10"
"SAFM MINERACAO LTDA","1"
"Mineração Pedra Menina Ltda","3"
"PEDREIRA SARGON LTDA","4"
"aparecido francisco da silva","1"
"JACOBINA MINERACAO E COMERCIO LTDA","2"
"Manoel Rodrigues Gimenes","1"
"PLINIO ALMEIDA BOSON & CIA LTDA","1"
"MORRO AGUDO MINERAIS LTDA","3"
"MINERACAO COMISA LTDA","2"
"MINERACOES GERAIS LTDA","2"
"NX GOLD S.A. Filial: NX GOLD S.A.","3"
"VALDEMIR CARLOS DE SOUZA","2"
"RUBENS GIMENEZ RODRIGUES","1"
"BURITIRAMA MINERACAO S.A. FALIDO","3"
"DEV MINERACAO S.A. - EM RECUPERACAO JUDICIAL","1"
"GINEZ GIMENES NETO","2"
"COOPERATIVA DOS GARIMPEIROS DE SANTA CRUZ - COOPERSANTA","4"
"MINERACAO TABIPORA LTDA","1"
"AMG BRASIL S.A.","1"
"Piteiras Mineração Ltda.","1"
"PARA PIGMENTOS S A","3"
"AVG EMPREENDIMENTOS MINERARIOS S.A.","4"
"EVANDRO DE SOUZA","1"
"Brasmic Mineração Areia e Brita Ltda","1"
"João Gabriel Guizzo","1"
"MINERACAO CARAIBA S/A","50"
"O MINERIO PARTICIPACOES LTDA","1"
"HERCULANO MINERACAO LTDA","3"
"william monteiro lipinisky","1"
"ITAQUAREIA INDUSTRIA EXTRATIVA DE MINERIOS LTDA","2"
"MINERACAO DESCALVADO LIMITADA","1"
"COOPERATIVA DE EXTRACAO DE METAIS E PEDRAS PRECIOSAS DE PONTES E LACERDA-MT","1"
"PORTO COMERCIO DE AREIA LTDA","1"
"COOPERATIVA DE MINERADORES E GARIMPEIROS DA REGIAO DE ARIPUANA - COOPEMIGA","1"
"Cleomenes Santos Silva","1"
"NOVELIS DO BRASIL LTDA.","1"
"NACIONAL DE GRAFITE LTDA","6"
"GREEN METALS NOVA ERA SOLUCOES AMBIENTAIS S.A","1"
"CARBETO DE SILICIO SIKA BRASIL LTDA","3"
"MORRO DOURADO LTDA","1"
"Roberto Eustáquio Silva Pedrosa","1"
"ANGELO CARLOS VICARI JUNIOR","2"
"Ronny Morais Costa","2"
"Geocal Mineração Ltda","1"
"DOMUS AUREA MINERACAO LTDA","1"
"MINERACAO ABDALA LTDA","3"
"EMPRESA DE MINERACAO HORII LTDA","1"
"FERRO + MINERACAO S.A.","2"
"T B K - MINERACAO LIMITADA","1"
"MULLER & CIA LTDA","2"
"VALE GOLD S.A.","1"
"CIMENTO TUPI S.A. EM RECUPERACAO JUDICIAL","2"
"MINERACAO USIMINAS S.A.","22"
"TECH ROCK MINERACAO LTDA","1"
"Construtora Martins Lanna Ltda.","2"
"José Vicente Nunes Rondon","1"
"Minerita Minérios Itaúna Ltda.","7"
